[
  {
    "category_code": "MILK_TEA",
    "region_level": "COUNTRY",
    "region_code": "CN",
    "metric_code": "FOOD_COST_RATE",
    "low_value": "0.38",
    "mid_value": "0.43",
    "high_value": "0.45",
    "unit": "RATE",
    "source_name": "华安证券《现制茶饮投资探讨：拥抱极致性价比与下沉时代》单店模型（7个茶饮品牌）",
    "source_url": "https://pdf.dfcfw.com/pdf/H3_AP202405311635047723_1.pdf",
    "source_date": "2024-05-31",
    "confidence_level": "MEDIUM",
    "review_status": "APPROVED",
    "valid_from": "2024-05-31"
  },
  {
    "category_code": "MILK_TEA",
    "region_level": "COUNTRY",
    "region_code": "CN",
    "metric_code": "LABOR_COST_RATE",
    "low_value": "0.13",
    "mid_value": "0.14",
    "high_value": "0.16",
    "unit": "RATE",
    "source_name": "华安证券《现制茶饮投资探讨：拥抱极致性价比与下沉时代》单店模型（7个茶饮品牌）",
    "source_url": "https://pdf.dfcfw.com/pdf/H3_AP202405311635047723_1.pdf",
    "source_date": "2024-05-31",
    "confidence_level": "MEDIUM",
    "review_status": "APPROVED",
    "valid_from": "2024-05-31"
  },
  {
    "category_code": "MILK_TEA",
    "region_level": "COUNTRY",
    "region_code": "CN",
    "metric_code": "RENT_TO_SALES_RATE",
    "low_value": "0.10",
    "mid_value": "0.12",
    "high_value": "0.17",
    "unit": "RATE",
    "source_name": "华安证券《现制茶饮投资探讨：拥抱极致性价比与下沉时代》单店模型（7个茶饮品牌）",
    "source_url": "https://pdf.dfcfw.com/pdf/H3_AP202405311635047723_1.pdf",
    "source_date": "2024-05-31",
    "confidence_level": "MEDIUM",
    "review_status": "APPROVED",
    "valid_from": "2024-05-31"
  },
  {
    "category_code": "MILK_TEA",
    "region_level": "COUNTRY",
    "region_code": "CN",
    "metric_code": "UTILITY_COST_RATE",
    "low_value": "0.03",
    "mid_value": "0.03",
    "high_value": "0.04",
    "unit": "RATE",
    "source_name": "华安证券《现制茶饮投资探讨：拥抱极致性价比与下沉时代》单店模型（7个茶饮品牌）",
    "source_url": "https://pdf.dfcfw.com/pdf/H3_AP202405311635047723_1.pdf",
    "source_date": "2024-05-31",
    "confidence_level": "MEDIUM",
    "review_status": "APPROVED",
    "valid_from": "2024-05-31"
  }
]
